{
  "schema_version": "1.0",
  "data_source": "demo",
  "video": {
    "name": "工程A・サンプル動画",
    "duration_sec": 7200,
    "size_bytes": null
  },
  "tt_sec": 4800,
  "standard_cards": [
    {
      "id": "S01",
      "name": "作業準備",
      "duration_sec": 180
    },
    {
      "id": "S02",
      "name": "部品の取り出し",
      "duration_sec": 420
    },
    {
      "id": "S03",
      "name": "位置合わせ",
      "duration_sec": 420
    },
    {
      "id": "S04",
      "name": "部品の取り付け",
      "duration_sec": 600
    },
    {
      "id": "S05",
      "name": "配線の接続",
      "duration_sec": 600
    },
    {
      "id": "S06",
      "name": "動作確認",
      "duration_sec": 480
    },
    {
      "id": "S07",
      "name": "外装の取り付け",
      "duration_sec": 720
    },
    {
      "id": "S08",
      "name": "外観検査",
      "duration_sec": 600
    },
    {
      "id": "S09",
      "name": "梱包",
      "duration_sec": 480
    },
    {
      "id": "S10",
      "name": "完成品の運搬",
      "duration_sec": 300
    }
  ],
  "modes": {
    "zero": {
      "segments": [
        {
          "id": "seg_001",
          "start_sec": 0,
          "end_sec": 196.364,
          "action": "作業台と工具を確認する",
          "activity": "prepare",
          "object": "工具一式",
          "tool": "映像で確認",
          "location": "作業台",
          "before": "工具が台に置かれている",
          "after": "使用する工具が並んだ",
          "evidence": "0:00〜3:16の前後状態を確認（架空の観察記録）",
          "standard_id": "S01",
          "match_status": "matched",
          "method_status": "unknown",
          "order_status": "unknown",
          "review_status": "verified",
          "note": ""
        },
        {
          "id": "seg_002",
          "start_sec": 196.364,
          "end_sec": 360,
          "action": "棚の中を確認し工具を探す",
          "activity": "search",
          "object": "工具ケース",
          "tool": "映像で確認",
          "location": "工具棚",
          "before": "目的の工具が見えていない",
          "after": "工具を取り出した",
          "evidence": "3:16〜6:00の前後状態を確認（架空の観察記録）",
          "standard_id": null,
          "match_status": "unmatched",
          "method_status": "unknown",
          "order_status": "unknown",
          "review_status": "verified",
          "note": ""
        },
        {
          "id": "seg_003",
          "start_sec": 360,
          "end_sec": 687.273,
          "action": "箱から部品を取り出す",
          "activity": "prepare",
          "object": "部品A",
          "tool": "映像で確認",
          "location": "部品棚",
          "before": "部品が箱にある",
          "after": "部品が台車に載った",
          "evidence": "6:00〜11:27の前後状態を確認（架空の観察記録）",
          "standard_id": "S02",
          "match_status": "matched",
          "method_status": "unknown",
          "order_status": "unknown",
          "review_status": "verified",
          "note": ""
        },
        {
          "id": "seg_004",
          "start_sec": 687.273,
          "end_sec": 883.637,
          "action": "台車から部品を作業台へ運ぶ",
          "activity": "move",
          "object": "部品A",
          "tool": "映像で確認",
          "location": "台車→作業台",
          "before": "部品が台車にある",
          "after": "作業台に置かれた",
          "evidence": "11:27〜14:43の前後状態を確認（架空の観察記録）",
          "standard_id": null,
          "match_status": "uncertain",
          "method_status": "unknown",
          "order_status": "unknown",
          "review_status": "draft",
          "note": "対象や操作の意味を確認してください。"
        },
        {
          "id": "seg_005",
          "start_sec": 883.637,
          "end_sec": 1341.819,
          "action": "治具に部品を置き位置を合わせる",
          "activity": "assembly",
          "object": "部品A・治具",
          "tool": "映像で確認",
          "location": "作業台",
          "before": "位置がずれている",
          "after": "治具の目印に合った",
          "evidence": "14:43〜22:21の前後状態を確認（架空の観察記録）",
          "standard_id": "S03",
          "match_status": "partial",
          "method_status": "unknown",
          "order_status": "unknown",
          "review_status": "draft",
          "note": ""
        },
        {
          "id": "seg_006",
          "start_sec": 1341.819,
          "end_sec": 1930.91,
          "action": "部品を固定してねじを締める",
          "activity": "assembly",
          "object": "部品A・ねじ",
          "tool": "ドライバー",
          "location": "作業台",
          "before": "部品が未固定",
          "after": "ねじが締められた",
          "evidence": "22:21〜32:10の前後状態を確認（架空の観察記録）",
          "standard_id": "S04",
          "match_status": "matched",
          "method_status": "unknown",
          "order_status": "unknown",
          "review_status": "draft",
          "note": ""
        },
        {
          "id": "seg_007",
          "start_sec": 1930.91,
          "end_sec": 2160.001,
          "action": "工具を持ち替えて締結を続ける",
          "activity": "assembly",
          "object": "ねじ・ドライバー",
          "tool": "映像で確認",
          "location": "作業台",
          "before": "一部のねじが未締結",
          "after": "残りのねじを締めた",
          "evidence": "32:10〜36:00の前後状態を確認（架空の観察記録）",
          "standard_id": null,
          "match_status": "uncertain",
          "method_status": "unknown",
          "order_status": "unknown",
          "review_status": "draft",
          "note": "対象や操作の意味を確認してください。"
        },
        {
          "id": "seg_008",
          "start_sec": 2160.001,
          "end_sec": 2683.637,
          "action": "ケーブルを取り出し接続する",
          "activity": "assembly",
          "object": "ケーブルB",
          "tool": "映像で確認",
          "location": "作業台",
          "before": "端子が未接続",
          "after": "コネクタが接続された",
          "evidence": "36:00〜44:43の前後状態を確認（架空の観察記録）",
          "standard_id": "S05",
          "match_status": "matched",
          "method_status": "unknown",
          "order_status": "unknown",
          "review_status": "draft",
          "note": ""
        },
        {
          "id": "seg_009",
          "start_sec": 2683.637,
          "end_sec": 2945.455,
          "action": "端子を見直し接続し直す",
          "activity": "assembly",
          "object": "ケーブルB",
          "tool": "映像で確認",
          "location": "作業台",
          "before": "接続部に再び触れる",
          "after": "端子を再接続した",
          "evidence": "44:43〜49:05の前後状態を確認（架空の観察記録）",
          "standard_id": null,
          "match_status": "uncertain",
          "method_status": "unknown",
          "order_status": "unknown",
          "review_status": "draft",
          "note": "対象や操作の意味を確認してください。"
        },
        {
          "id": "seg_010",
          "start_sec": 2945.455,
          "end_sec": 3272.728,
          "action": "装置を操作して動作を確認する",
          "activity": "inspect",
          "object": "操作パネル",
          "tool": "映像で確認",
          "location": "検査台",
          "before": "装置が停止中",
          "after": "検査が開始された",
          "evidence": "49:05〜54:32の前後状態を確認（架空の観察記録）",
          "standard_id": "S06",
          "match_status": "matched",
          "method_status": "unknown",
          "order_status": "unknown",
          "review_status": "draft",
          "note": ""
        },
        {
          "id": "seg_011",
          "start_sec": 3272.728,
          "end_sec": 3992.728,
          "action": "装置の動作が終わるまで待つ",
          "activity": "wait",
          "object": "装置",
          "tool": "映像で確認",
          "location": "検査台",
          "before": "検査が動作中",
          "after": "完了表示が出た",
          "evidence": "54:32〜66:32の前後状態を確認（架空の観察記録）",
          "standard_id": null,
          "match_status": "unmatched",
          "method_status": "unknown",
          "order_status": "unknown",
          "review_status": "draft",
          "note": ""
        },
        {
          "id": "seg_012",
          "start_sec": 3992.728,
          "end_sec": 4189.092,
          "action": "外装パネルを取り出す",
          "activity": "prepare",
          "object": "外装パネル",
          "tool": "映像で確認",
          "location": "部品棚",
          "before": "パネルが棚にある",
          "after": "台へ運び出した",
          "evidence": "66:32〜69:49の前後状態を確認（架空の観察記録）",
          "standard_id": "S07",
          "match_status": "matched",
          "method_status": "unknown",
          "order_status": "unknown",
          "review_status": "draft",
          "note": ""
        },
        {
          "id": "seg_013",
          "start_sec": 4189.092,
          "end_sec": 4778.183,
          "action": "外装パネルを取り付ける",
          "activity": "assembly",
          "object": "外装パネル",
          "tool": "映像で確認",
          "location": "作業台",
          "before": "外装が未装着",
          "after": "外装が取り付けられた",
          "evidence": "69:49〜79:38の前後状態を確認（架空の観察記録）",
          "standard_id": "S07",
          "match_status": "matched",
          "method_status": "unknown",
          "order_status": "unknown",
          "review_status": "draft",
          "note": ""
        },
        {
          "id": "seg_014",
          "start_sec": 4778.183,
          "end_sec": 5007.274,
          "action": "画面外で作業が続いている",
          "activity": "unknown",
          "object": "不明",
          "tool": "映像で確認",
          "location": "作業台付近",
          "before": "手元が見えない",
          "after": "映像内へ戻った",
          "evidence": "79:38〜83:27の前後状態を確認（架空の観察記録）",
          "standard_id": null,
          "match_status": "uncertain",
          "method_status": "unknown",
          "order_status": "unknown",
          "review_status": "draft",
          "note": ""
        },
        {
          "id": "seg_015",
          "start_sec": 5007.274,
          "end_sec": 5530.91,
          "action": "外観を確認して部品に触れる",
          "activity": "inspect",
          "object": "完成品",
          "tool": "映像で確認",
          "location": "検査台",
          "before": "検査前",
          "after": "外観確認が終了した",
          "evidence": "83:27〜92:10の前後状態を確認（架空の観察記録）",
          "standard_id": null,
          "match_status": "uncertain",
          "method_status": "unknown",
          "order_status": "unknown",
          "review_status": "draft",
          "note": "対象や操作の意味を確認してください。"
        },
        {
          "id": "seg_016",
          "start_sec": 5530.91,
          "end_sec": 5890.91,